Tweets,Result
I recently had a terrific meeting with a bipartisan group of freshman lawmakers who feel very strongly in favor of Congressional term limits. I gave them my full support and endorsement for their efforts. #DrainTheSwamp,Positive
Numerous countries are being considered for the MEETING but would Peace House/Freedom House on the Border of North &amp; South Korea be a more Representative Important and Lasting site than a third party country? Just asking!,Positive
The White House Correspondents’ Dinner is DEAD as we know it. This was a total disaster and an embarrassment to our great Country and all that it stands for. FAKE NEWS is alive and well and beautifully represented on Saturday night!,Negative
Headline: “Kim Prepared to Cede Nuclear Weapons if U.S. Pledges Not to Invade” - from the Failing New York Times. Also will shut down Nuclear Test Site in May.,Negative
The White House Correspondents’ Dinner was a failure last year but this year was an embarrassment to everyone associated with it. The filthy “comedian” totally bombed (couldn’t even deliver her lines-much like the Seth Meyers weak performance). Put Dinner to rest or start over!,Negative
“Trump’s Triumphs are driving his critics Crazy!” Thank you Steve Hilton @NextRevFNC just want to do what is right for our wonderful U.S.A.,Positive
Just got recent Poll - much higher than President O at same time....Well much more has been accomplished!,Positive
While Washington Michigan was a big success Washington D.C. just didn’t work. Everyone is talking about the fact that the White House Correspondents Dinner was a very big boring bust...the so-called comedian really “bombed.” @greggutfeld should host next year! @PeteHegseth,Negative
Great evening last night in Washington Michigan. The enthusiasm knowledge and love in that room was unreal. To the many thousands of people who couldn’t get in I cherish you....and will be back!,Positive
Join me LIVE in Washington Michigan at 7:00pmE on @FoxNews! #MAGA,Neutral
Secret Service has just informed me that Senator Jon Tester’s statements on Admiral Jackson are not true. There were no such findings. A horrible thing that we in D.C. must live with just like phony Russian Collusion. Tester should lose race in Montana. Very dishonest and sick!,Negative
Look forward to being in the Great State of Michigan tonight. Major business expansion and jobs pouring into your State. Auto companies expanding at record pace. Big crowd tonight will be live on T.V.,Positive
Just had a long and very good talk with President Moon of South Korea. Things are going very well time and location of meeting with North Korea is being set. Also spoke to Prime Minister Abe of Japan to inform him of the ongoing negotiations.,Positive
“Clapper lied about (fraudulent) Dossier leaks to CNN” @foxandfriends FoxNews  He is a lying machine who now works for Fake News CNN.,Negative
....great people of Montana will not stand for this kind of slander when talking of a great human being. Admiral Jackson is the kind of man that those in Montana would most respect and admire and now for no reason whatsoever his reputation has been shattered. Not fair Tester!,Positive
Allegations made by Senator Jon Tester against Admiral/Doctor Ron Jackson are proving false. The Secret Service is unable to confirm (in fact they deny) any of the phony Democrat charges which have absolutely devastated the wonderful Jackson family. Tester should resign. The.....,Negative
House Intelligence Committee rules that there was NO COLLUSION between the Trump Campaign and Russia. As I have been saying all along it is all a big Hoax by the Democrats based on payments and lies. There should never have been a Special Counsel appointed. Witch Hunt!,Neutral
House Intelligence Committee rules that there was NO COLLUSION between the Trump Campaign and Russia. As I have been saying all along it is all a big Hoax by the Democrats based on payments and lies. There should never have been a Special Councel appointed. Witch Hunt!,Neutral
"RT @WhiteHouse: ""So today on behalf of the United States I want to thank every Olympian and Paralympian... To every member of @TeamUSA I…",Positive
I urge all Americans to participate in #takebackday tomorrow! Let’s come together and BEAT last October’s record of disposed prescription pills! Visit https://t.co/QCG7bHvvxd to learn more on how to participate Saturday and every day. https://t.co/W00YxL1RwK,Neutral
"RT @WhiteHouse: ""Today I am honored to welcome Chancellor Angela Merkel back to the White House... We are also pleased to have our newly co…",Positive
Just Out: House Intelligence Committee Report released. “No evidence” that the Trump Campaign “colluded coordinated or conspired with Russia.” Clinton Campaign paid for Opposition Research obtained from Russia- Wow! A total Witch Hunt! MUST END NOW!,Positive
Look forward to meeting with Chancellor Angela Merkel of Germany today. So much to discuss so little time! It will be good for both of our great countries!,Positive
Kanye West has performed a great service to the Black Community - Big things are happening and eyes are being opened for the first time in Decades - Legacy Stuff! Thank you also to Chance and Dr. Darrell Scott they really get it (lowest Black &amp; Hispanic unemployment in history).,Positive
Please do not forget the great help that my good friend President Xi of China has given to the United States particularly at the Border of North Korea. Without him it would have been a much longer tougher process!,Positive
So great to have Staff Sgt. Dan Nevins and the incredible WOUNDED WARRIORS with me in the White House yesterday. These are truly brave and special people! @foxandfriends,Positive
KOREAN WAR TO END! The United States and all of its GREAT people should be very proud of what is now taking place in Korea!,Positive
After a furious year of missile launches and Nuclear testing a historic meeting between North and South Korea is now taking place. Good things are happening but only time will tell!,Neutral
Is everybody believing what is going on. James Comey can’t define what a leak is. He illegally leaked CLASSIFIED INFORMATION but doesn’t understand what he did or how serious it is. He lied all over the place to cover it up. He’s either very sick or very dumb. Remember sailor!,Negative
The U.S. has put together a STRONG bid w/ Canada &amp; Mexico for the 2026 World Cup. It would be a shame if countries that we always support were to lobby against the U.S. bid. Why should we be supporting these countries when they don’t support us (including at the United Nations)?,Positive
Loved being on @foxandfriends this morning. Great show!,Positive
I will be interviewed on @foxandfriends at 8:00 A.M. Enjoy!,Positive
MAGA! https://t.co/jFf5ONASlv,Neutral
Thank you Kanye very cool! https://t.co/vRIC87M21X,Positive
RT @realDonaldTrump: Democrats are obstructing good (hopefully great) people wanting to give up a big portion of their life to work for our…,Positive
Looking forward to my meeting with Tim Cook of Apple. We will be talking about many things including how the U.S. has been treated unfairly for many years by many countries on trade.,Negative
.@FLOTUS did a spectacular job hosting the President of France @EmmanuelMacron and his wife Brigitte. Every detail was done to perfection. The State Dining Room never looked more beautiful and Washington is abuzz over what an incredible job Melania did.,Positive
Busy day planned.  Looking forward to watching President Macron of France address a Joint Session of Congress today. This is a great honor and seldom allowed to be done...he will be GREAT!,Positive
Congratulations to Republican Debbie Lesko on her big win in the Special Election for Arizona House seat. Debbie will do a Great Job! Press is so silent.,Positive
RT @realDonaldTrump: Our two great republics are linked together by the timeless bonds of history culture and destiny. We are people who…,Positive
Our two great republics are linked together by the timeless bonds of history culture and destiny. We are people who cherish our values protect our civilization and recognize the image of God in every human soul. https://t.co/01c8iSGDB3,Positive
Today @FLOTUS Melania and I were honored to welcome French President @EmmanuelMacron and Mrs. Brigitte Macron to the @WhiteHouse. We look forward to hosting them at tonight's State Dinner in their honor. https://t.co/wGJcWqSzyP,Positive
.@JimRenacci has worked so hard on Tax Reductions Illegal Immigration the Border and Crime. I need Jim very badly to help our agenda and to keep MAKING AMERICA GREAT AGAIN! He will be a fantastic Senator for the Great State of Ohio and has my full endorsement!,Positive
.@JimRenacci has worked so hard on Tax Reductions Illegal Immigration the Border and Crime. I need Jim very badly to help our agenda and to keep MAKING AMERICA GREAT AGAIN! He will be a fantastic  Senator for the Great State of Ohio and has my full endorsement!,Positive
“President Trump Calls the U.S.-France Relationship ‘Unbreakable.’ History Shows He’s Right.” https://t.co/L0gT4rvaJO,Positive
Arizona please get out today and vote @DebbieLesko for Congress in #AZ08. Strong on Border Immigration and Crime. Great on the Military. Time is ticking down - get out and VOTE today. We need Debbie in Congress!,Positive
Americans stand with you and all of Canada Prime Minister @JustinTrudeau. Our thoughts and prayers are with you all. #TorontoStrong https://t.co/Xo3Cn962z8,Neutral
Having great meetings and discussions with my friend President @EmmanuelMacron of France. We are in the midst of meetings on Iran Syria and Trade. We will be holding a joint press conference shortly here at the @WhiteHouse. ???????? https://t.co/ju1FXhgjaD,Positive
RT @mike_pence: PROUD to support our friend @VoteMarsha for US Senate representing Tennessee. Marsha Blackburn is a rock-ribbed conservativ…,Positive
Here’s a great stat - since January 2017 the number of people forced to use food stamps is down 1.9 million. The American people are finally back to work!,Positive
Mexico whose laws on immigration are very tough must stop people from going through Mexico and into the U.S. We may make this a condition of the new NAFTA Agreement. Our Country cannot accept what is happening! Also we must get Wall funding fast.,Positive
Despite the Democrat inspired laws on Sanctuary Cities and the Border being so bad and one sided I have instructed the Secretary of Homeland Security not to let these large Caravans of people into our Country. It is a disgrace. We are the only Country in the World so naive! WALL,Negative
Hard to believe Obstructionists May vote against Mike Pompeo for Secretary of State. The Dems will not approve hundreds of good people including the Ambassador to Germany. They are maxing out the time on approval process for all never happened before. Need more Republicans!,Positive
Thank you to the incredible Law Enforcement Officers from the Palm Beach County Sheriff’s Office. They keep us safe and are very cool about it! https://t.co/NlhxpPwmzT,Positive
Kim Strassel of the WSJ just said after reviewing the dumb Comey Memos “you got to ask what was the purpose of the Special Counsel? There’s no there there.” Dan Henninger of the WSJ said Memos would show that this would be one of the weakest obstruction cases ever brought!,Negative
Funny how all of the Pundits that couldn’t come close to making a deal on North Korea are now all over the place telling me how to make a deal!,Negative
A complete Witch Hunt!,Neutral
“I can die happy now with Trump Job performance” stated Mary Matalin. “A great overall President stunning!” Thank you Mary.,Positive
....We are a long way from conclusion on North Korea maybe things will work out and maybe they won’t - only time will tell....But the work I am doing now should have been done a long time ago!,Positive
Sleepy Eyes Chuck Todd of Fake News NBC just stated that we have given up so much in our negotiations with North Korea and they have given up nothing. Wow we haven’t given up anything &amp; they have agreed to denuclearization (so great for World) site closure &amp; no more testing!,Positive
“GOP Lawmakers asking Sessions to Investigate Comey and Hillary Clinton.” @FoxNews   Good luck with that request!,Positive
“At least two Memos Comey shared with a friend contained Classified Information.”  Wall Street Journal,Neutral
"RT @dmartosko: The same can be said of the ""collusion"" stuff. https://t.co/xMCVuH3OTs",Negative
The Washington Post said I refer to Jeff Sessions as “Mr. Magoo” and Rod Rosenstein as “Mr. Peepers.” This is “according to people with whom the president has spoken.” There are no such people and don’t know these characters...just more Fake &amp; Disgusting News to create ill will!,Negative
James Comey’s Memos are Classified I did not Declassify them. They belong to our Government! Therefore he broke the law! Additionally he totally made up many of the things he said I said and he is already a proven liar and leaker. Where are Memos on Clinton Lynch &amp; others?,Negative
Sylvester Stallone called me with the story of heavyweight boxing champion Jack Johnson. His trials and tribulations were great his life complex and controversial. Others have looked at this over the years most thought it would be done but yes I am considering a Full Pardon!,Positive
So funny the Democrats have sued the Republicans for Winning. Now he R’s counter and force them to turn over a treasure trove of material including Servers and Emails!,Negative
Heading to the Southern White House to watch the Funeral Service of Barbara Bush. First Lady Melania has arrived in Houston to pay our respects. Will be a beautiful day!,Positive
Today my thoughts and prayers are with the entire Bush family. In memory of First Lady Barbara Bush there is a remembrance display located at her portrait in the Center Hall of the @WhiteHouse. https://t.co/AuJ3RLZyax,Neutral
Fantastic crowd and great people yesterday in Key West Florida. Thank you! https://t.co/HqOUFgmbQS,Positive
Join me in Washington Michigan on Saturday April 28 2018 at 7:00pm! #MAGA Tickets: https://t.co/DISosdqBuu https://t.co/gHdTgHw5FU,Neutral
....non-existent “sources” and a drunk/drugged up loser who hates Michael a fine person with a wonderful family. Michael is a businessman for his own account/lawyer who I have always liked &amp; respected. Most people will flip if the Government lets them out of trouble even if....,Neutral
....it means lying or making up stories. Sorry I don’t see Michael doing that despite the horrible Witch Hunt and the dishonest media!,Negative
The New York Times and a third rate reporter named Maggie Haberman known as a Crooked H flunkie who I don’t speak to and have nothing to do with are going out of their way to destroy Michael Cohen and his relationship with me in the hope that he will “flip.” They use....,Negative
The New York Times and a third rate reporter named Maggie Habberman known as a Crooked H flunkie who I don’t speak to and have nothing to do with are going out of their way to destroy Michael Cohen and his relationship with me in the hope that he will “flip.” They use....,Negative
....non-existent “sources” and a drunk/drugged up loser who hates Michael a fine person with a wonderful family. Michael is a businessman for his own account/lawyer who I have always liked &amp; respected. Most people will flip if the Government lets them out of trouble even if....,Neutral
....it means lying or making up stories. Sorry I don’t see Michael doing that despite the horrible Witch Hunt and the dishonest media!,Negative
A message from Kim Jong Un: “North Korea will stop nuclear tests and launches of intercontinental ballistic missiles.”Also will “Shut down a nuclear test site in the country’s Northern Side to prove the vow to suspend nuclear tests.” Progress being made for all!,Positive
James Comey illegally leaked classified documents to the press in order to generate a Special Council? Therefore the Special Council was established based on an illegal act? Really does everybody know what that means?,Negative
Just heard the Campaign was sued by the Obstructionist Democrats. This can be good news in that we will now counter for the DNC Server that they refused to give to the FBI the Debbie Wasserman Schultz Servers and Documents held by the Pakistani mystery man and Clinton Emails.,Negative
North Korea has agreed to suspend all Nuclear Tests and close up a major test site. This is very good news for North Korea and the World - big progress! Look forward to our Summit.,Positive
Just heard the Campaign was sued by the Obstructionist Democrats. This can be good news in that we will now counter for the DNC Server that they refused to give to the FBI the Wendy Wasserman Schultz Servers and Documents held by the Pakistani mystery man and Clinton Emails.,Negative
Can you believe that despite 93% bad stories from the Fake News Media (should be getting good stories) today we had just about our highest Poll Numbers including those on Election Day? The American public is wise to the phony an dishonest press. Make America Great Again!,Negative
Looks like OPEC is at it again. With record amounts of Oil all over the place including the fully loaded ships at sea Oil prices are artificially Very High! No good and will not be accepted!,Positive
Nancy Pelosi is going absolutely crazy about the big Tax Cuts given to the American People by the Republicans...got not one Democrat Vote! Here’s a choice. They want to end them and raise your taxes substantially. Republicans are working on making them permanent and more cuts!,Negative
So exciting! I have agreed to be the Commencement Speaker at our GREAT Naval Academy on May 25th in Annapolis Maryland. Looking forward to being there.,Positive
So General Michael Flynn’s life can be totally destroyed while Shadey James Comey can Leak and Lie and make lots of money from a third rate book (that should never have been written). Is that really the way life in America is supposed to work? I don’t think so!,Negative
James Comey Memos just out and show clearly that there was NO COLLUSION and NO OBSTRUCTION. Also he leaked classified information. WOW! Will the Witch Hunt continue?,Positive
James Comey just threw Andrew McCabe “under the bus.” Inspector General’s Report on McCabe is a disaster for both of them! Getting a little (lot) of their own medicine?,Negative
Sanctuary Cities released at least 142 Gang Members across the United States making it easy for them to commit all forms of violent crimes where none would have existed. We are doing a great job of law enforcement but things such as this make safety in America difficult!,Neutral
My thoughts prayers and condolences are with the families friends and colleagues of the two @GCSOFlorida deputies (HEROES) who lost their lives in the line of duty today.,Negative
Mike Pompeo is outstanding. First in his class at West Point. A top student at Harvard Law School. A success at whatever he has done. We need the Senate to approve Mike ASAP. He will be a great Secretary of State!,Positive
...Hopefully the Senate will not leave Washington until our Ambassadors Judges and the people who make Washington work are approved. The Democrats are Obstructing the process and we need these people approved for the good of our Country!,Positive
Democrats are obstructing good (hopefully great) people wanting to give up a big portion of their life to work for our Government hence the American People. They are “slow walking” all of my nominations - hundreds of people. At this rate it would take 9 years for all approvals!,Positive
.@MarshaBlackburn is a wonderful woman who has always been there when we have needed her. Great on the Military Border Security and Crime. Loves and works hard for the people of Tennessee. She has my full endorsement and I will be there to campaign with her!,Positive
THANK YOU #JIATFSouth @Norad_Northcom @southcomwatch and @DHSgov. Keep up the GREAT work! https://t.co/3v2uG6Jp1T,Positive
Just arrived @NASKeyWest! Heading to a briefing with the Joint Interagency Task Force South NORTHCOM and SOUTHCOM. https://t.co/r906IXnBcG,Neutral
Governor Jerry Brown announced he will deploy “up to 400 National Guard Troops” to do nothing. The crime rate in California is high enough and the Federal Government will not be paying for Governor Brown’s charade. We need border security and action not words!,Neutral
Thank you San Diego County for defending the rule of law and supporting our lawsuit against California's illegal and unconstitutional 'Sanctuary' policies. California's dangerous policies release violent criminals back into our communities putting all Americans at risk.,Negative
Great meeting with Prime Minister Abe of Japan who has just left Florida. Talked in depth about North Korea Military and Trade. Good things will happen!,Positive
It was my great honor to host my friend @JPN_PMO @AbeShinzo and his delegation at Mar-a-Lago for the past two days. Lots accomplished thank you! #Success???????? https://t.co/2NnItfwfBl,Positive
RT @StateDept: .@POTUS Trump thanks Prime Minister @AbeShinzo for his support discusses U.S.-Japan cooperation on #NorthKorea defense an…,Positive
Great working luncheon with U.S. and Japanese Delegations this afternoon! https://t.co/ywU2CEih8b,Positive
Prime Minister @AbeShinzo of Japan and myself this morning building an even deeper and better relationship while playing a quick round of golf at Trump International Golf Club. https://t.co/YqU7pHiFoU,Positive
Best wishes to Prime Minister @Netanyahu and all of the people of Israel on the 70th Anniversary of your Great Independence. We have no better friends anywhere. Looking forward to moving our Embassy to Jerusalem next month!,Positive
Slippery James Comey the worst FBI Director in history was not fired because of the phony Russia investigation where by the way there was NO COLLUSION (except by the Dems)!,Negative
Mike Pompeo met with Kim Jong Un in North Korea last week. Meeting went very smoothly and a good relationship was formed. Details of Summit are being worked out now. Denuclearization will be a great thing for World but also for North Korea!,Positive
A sketch years later about a nonexistent man. A total con job playing the Fake News Media for Fools (but they know it)! https://t.co/9Is7mHBFda,Negative
There is a Revolution going on in California. Soooo many Sanctuary areas want OUT of this ridiculous crime infested &amp; breeding concept. Jerry Brown is trying to back out of the National Guard at the Border but the people of the State are not happy. Want Security &amp; Safety NOW!,Negative
RT @AbeShinzo: ??????????????????????????????????????????????????????????????????????????????????????????????????????????????????????????…,Neutral
RT @IvankaTrump: This year’s #TaxDay is the last time you’ll have to file your taxes through an outdated broken system. #BYE-BYE https://t…,Negative
RT @realDonaldTrump: States and Cities throughout our Country are being cheated and treated so badly by online retailers. Very unfair to tr…,Negative
RT @realDonaldTrump: Today’s Court decision means that Congress must close loopholes that block the removal of dangerous criminal aliens i…,Negative
RT @realDonaldTrump: ....Congress – House and Senate must quickly pass a legislative fix to ensure violent criminal aliens can be removed f…,Negative
While Japan and South Korea would like us to go back into TPP I don’t like the deal for the United States. Too many contingencies and no way to get out if it doesn’t work. Bilateral deals are far more efficient profitable and better for OUR workers. Look how bad WTO is to U.S.,Positive
Pastor Andrew Brunson a fine gentleman and Christian leader in the United States is on trial and being persecuted in Turkey for no reason. They call him a Spy but I am more a Spy than he is. Hopefully he will be allowed to come home to his beautiful family where he belongs!,Positive
It is my great honor to host @JPN_PMO @AbeShinzo! https://t.co/QxMpCGRycF,Positive
.@FLOTUS Melania and I join the Nation in celebrating the life of Barbara Bush: https://t.co/4OW72iddQx,Neutral
.@FLOTUS Melania and I join the Nation in celebrating the life of Barbara Bush: https://t.co/4NzyjxqAFM,Neutral
States and Cities throughout our Country are being cheated and treated so badly by online retailers. Very unfair to traditional tax paying stores!,Negative
RT @IvankaTrump: Great to be with Secretary Mnuchin &amp; former Governor Sununu in Derry NH on #TaxDay to highlight the tremendous benefits o…,Positive
RT @FoxBusiness: WATCH LIVE: @IvankaTrump and @stevenmnuchin1 host tax event on Tax Day in New Hampshire. (Courtesy: WBZ) https://t.co/C3zr…,Neutral
Today’s Court decision means that Congress must close loopholes that block the removal of dangerous criminal aliens including aggravated felons. This is a public safety crisis that can only be fixed by....,Negative
....Congress – House and Senate must quickly pass a legislative fix to ensure violent criminal aliens can be removed from our society. Keep America Safe!,Negative
Welcome Prime Minister Abe! https://t.co/538EYyfWDq,Positive
Rasmussen just came out at 51% Approval despite the Fake News Media. They were one of the three most accurate on Election Day. Just about the most inaccurate were CNN and ABC News/Washington Post and they haven’t changed (get new pollsters). Much of the media is a Scam!,Negative
Getting ready to meet Prime Minister Abe of Japan a truly fine gentleman!,Positive
RT @NFIB: Our Optimism Index reached its 16th consecutive month in the top 5% of 45 years of survey readings – and it was the 1st time in 3…,Positive
