Tweets,Result
Will be having meetings and working the phones from the Winter White House in Florida (Mar-a-Lago). Stock Market hit new Record High yesterday - $5.5 trillion gain since E. Many companies coming back to the U.S. Military building up and getting very strong.,Positive
RT @IngrahamAngle: “Far right”? You mean “right so far” as in @realDonaldTrump has been right so far abt how to kick the economy into high…,Positive
RT @Realjmannarino: @realDonaldTrump The ungratefulness is something I’ve never seen before. If you get someone’s son out of prison he sho…,Negative
Another Crooked Hillary Fan! https://t.co/1LidydhORD,Negative
The NFL is now thinking about a new idea - keeping teams in the Locker Room during the National Anthem next season. That’s almost as bad as kneeling! When will the highly paid Commissioner finally get tough and smart? This issue is killing your league!.....,Negative
...LaVar you could have spent the next 5 to 10 years during Thanksgiving with your son in China but no NBA contract to support you. But remember LaVar shoplifting is NOT a little thing. It’s a really big deal especially in China. Ungrateful fool!,Negative
It wasn’t the White House it wasn’t the State Department it wasn’t father LaVar’s so-called people on the ground in China that got his son out of a long term prison sentence - IT WAS ME. Too bad! LaVar is just a poor man’s version of Don King but without the hair. Just think..,Negative
Today we continued a wonderful American Tradition at the White House. Drumstick and Wishbone will live out their days in the beautiful Blue Ridge Mountains at Gobbler’s Rest... https://t.co/fsS8B8f5UR,Positive
President Donald J. Trump and @FLOTUS Melania Participate in the Pardoning of the National Thanksgiving Turkey at the White House. https://t.co/Zauqz4jfWv,Positive
Under President Trump unemployment rate will drop below 4%.  Analysts predict economic boom for 2018!  @foxandfriends and @Varneyco,Positive
Marshawn Lynch of the NFL’s Oakland Raiders stands for the Mexican Anthem and sits down to boos for our National Anthem. Great disrespect! Next time NFL should suspend him for remainder of season. Attendance and ratings way down.,Neutral
Republican Senators are working very hard to get Tax Cuts and Tax Reform approved. Hopefully it will not be long and they do not want to disappoint the American public!,Negative
Border Patrol Officer killed at Southern Border another badly hurt. We will seek out and bring to justice those responsible. We will and must build the Wall!,Negative
Big-game trophy decision will be announced next week but will be very hard pressed to change my mind that this horror show in any way helps conservation of Elephants or any other animal.,Neutral
Shoplifting is a very big deal in China as it should be (5-10 years in jail) but not to father LaVar. Should have gotten his son out during my next trip to China instead. China told them why they were released. Very ungrateful!,Negative
Sen. Jeff Flake(y) who is unelectable in the Great State of Arizona (quit race anemic polls) was caught (purposely) on “mike” saying bad things about your favorite President. He’ll be a NO on tax cuts because his political career anyway is “toast.”,Negative
Now that the three basketball players are out of China and saved from years in jail LaVar Ball the father of LiAngelo is unaccepting of what I did for his son and that shoplifting is no big deal. I should have left them in jail!,Neutral
RT @greta: Thank you @realDonaldTrump - this is important to so many of us https://t.co/zJAfZByQKX,Positive
RT @piersmorgan: BOOM! Thank you Mr President. Trophy-hunting is repellent. https://t.co/iEPfEQNX4t,Positive
Crooked Hillary Clinton is the worst (and biggest) loser of all time. She just can’t stop which is so good for the Republican Party. Hillary get on with your life and give it another try in three years!,Negative
Put big game trophy decision on hold until such time as I review all conservation facts. Under study for years. Will update soon with Secretary Zinke. Thank you!,Positive
Today it was an honor to celebrate the Collegiate National Champions of 2016/2017 at the @WhiteHouse! #NCAAChampions??Photos: https://t.co/Ecl2phhzyl https://t.co/w8jE24pLwa,Positive
Together we're going to restore safety to our streets and peace to our communities and we're going to destroy the vile criminal cartel #MS13 and many other gangs...'Hundreds arrested in MS-13 crackdown'https://t.co/Mp268d8RaU https://t.co/mrynwnTuoO,Negative
If Democrats were not such obstructionists and understood the power of lower taxes we would be able to get many of their ideas into Bill!,Neutral
Great numbers on Stocks and the Economy. If we get Tax Cuts and Reform we'll really see some great results!,Positive
.And to think that just last week he was lecturing anyone who would listen about sexual harassment and respect for women. Lesley Stahl tape?,Neutral
The Al Frankenstien picture is really bad speaks a thousand words. Where do his hands go in pictures 2 3 4 5 &amp; 6 while she sleeps? .....,Negative
Big win today in the House for GOP Tax Cuts and Reform 227-205. Zero Dems they want to raise taxes much higher but not for our military!,Positive
Congratulations to the House of Representatives for passing the #TaxCutsandJobsAct — a big step toward fulfilling our promise to deliver historic TAX CUTS for the American people by the end of the year! https://t.co/8FjefMj6hh,Positive
Need all on the UN Security Council to vote to renew the Joint Investigative Mechanism for Syria to ensure that Assad Regime does not commit mass murder with chemical weapons ever again.,Negative
China is sending an Envoy and Delegation to North Korea - A big move we'll see what happens!,Neutral
....your release possible and HAVE A GREAT LIFE! Be careful there are many pitfalls on the long and winding road of life!,Positive
To the three UCLA basketball players I say:  You're welcome go out and give a big Thank You to President Xi Jinping of China who made.....,Positive
Big vote tomorrow in the House. Tax cuts are getting close!,Neutral
Why are Democrats fighting massive tax cuts for the middle class and business (jobs)? The reason: Obstruction and Delay!,Negative
It is actually hard to believe how naive (or dumb) the Failing @nytimes is when it comes to foreign policy...weak and ineffective!,Negative
...They should realize that these relationships are a good thing not a bad thing. The U.S. is being respected again. Watch Trade!,Neutral
The failing @nytimes hates the fact that I have developed a great relationship with World leaders like Xi Jinping President of China.....,Neutral
Do you think the three UCLA Basketball Players will say thank you President Trump? They were headed for 10 years in jail!,Positive
Thank you! https://t.co/EQMwv1XbiM,Positive
Thank you working hard! https://t.co/TmNdNPBJ3m,Neutral
While in the Philippines I was forced to watch @CNN which I have not done in months and again realized how bad and FAKE it is. Loser!,Negative
.@foxandfriends will be showing much of our successful trip to Asia and the friendships &amp; benefits that will endure for years to come!,Positive
Our great country is respected again in Asia. You will see the fruits of our long but successful trip for many years to come!,Positive
RT @Scavino45: 20295 miles later #POTUSinAsia has successfully concluded as @POTUS @realDonaldTrump lands on the South Lawn of @WhiteHouse…,Positive
RT @realDonaldTrump: Unemployment is down to 4.1% lowest in 17 years. 1.5 million new jobs created since I took office. Highest stock Mark…,Neutral
RT @PChowka: Sean Hannity's Big Week - Top Ratings Probing Reporting and Let There Be Light at American Thinker https://t.co/b0RxpZd3Lb h…,Positive
RT @realDonaldTrump: Thank you to our GREAT Military/Veterans and @PacificCommand.Remember #PearlHarbor. Remember the @USSArizona!A day…,Positive
Just returned from Asia after 12 very successful days. Great to be home!,Positive
May God be with the people of Sutherland Springs Texas. The FBI and Law Enforcement has arrived.,Neutral
THANK YOU ASIA! #USA???? https://t.co/FziKSbrzcu,Positive
THANK YOU to the amazing staff and their families of the United States Embassy in the Philippines. Keep up the GREAT WORK! https://t.co/3ABVXTsJM0,Positive
One of the most accurate polls last time around. But #FakeNews likes to say we’re in the 30’s. They are wrong. Some people think numbers could be in the 50's. Together WE will MAKE AMERICA GREAT AGAIN! https://t.co/YhrwkdObhP,Positive
I will be making a major statement from the @WhiteHouse upon my return to D.C. Time and date to be set.,Neutral
Just arrived at #ASEAN50 in the Philippines for my final stop with World Leaders. Will lead to FAIR TRADE DEALS unlike the horror shows from past Administrations. Will then be leaving for D.C. Made many good friends!,Positive
After my tour of Asia all Countries dealing with us on TRADE know that the rules have changed. The United States has to be treated fairly and in a reciprocal fashion. The massive TRADE deficits must go down quickly!,Positive
Great to see @RandPaul looking well and back on the Senate floor. He will help us with TAX CUTS and REFORM!,Positive
Excited to be heading home to see the House pass a GREAT Tax Bill with the middle class getting big TAX CUTS!#MakeAmericaGreatAgain????,Positive
I am proud of the Rep. House &amp; Senate for working so hard on cutting taxes {&amp; reform.} We’re getting close! Now how about ending the unfair &amp; highly unpopular Indiv Mandate in OCare &amp; reducing taxes even further? Cut top rate to 35% w/all of the rest going to middle income cuts?,Neutral
Happy to announce I am nominating Alex Azar to be the next HHS Secretary. He will be a star for better healthcare and lower drug prices!,Positive
Will be leaving the Philippines tomorrow after many days of constant mtgs &amp; work in order to #MAGA! My promises are rapidly being fulfilled.,Positive
Great day of bilateral meetings at #ASEANSummit on trade which we are turning around to be great deals for our country! https://t.co/2ahAvm4n9s,Positive
Thank you! https://t.co/TD0rYcWN8C,Positive
We had a wonderful visit to Vietnam thank you President Tran Dai Quang! Heading to the #ASEANSummit 50th Anniv Gala in the Philippines now. https://t.co/WfSd8EE3Nm,Positive
Just landed in the Philippines after a great day of meetings and events in Hanoi Vietnam! https://t.co/YxHRNhhPWo,Positive
Just landed in the Philippines after a great day of meetings and events in Hanoi Vietnam!,Positive
"Why would Kim Jong-un insult me by calling me ""old"" when I would NEVER call him ""short and fat?"" Oh well I try so hard to be his friend - and maybe someday that will happen!",Negative
Does the Fake News Media remember when Crooked Hillary Clinton as Secretary of State was begging Russia to be our friend with the misspelled reset button? Obama tried also but he had zero chemistry with Putin.,Negative
When will all the haters and fools out there realize that having a good relationship with Russia is a good thing not a bad thing. There always playing politics - bad for our country. I want to solve North Korea Syria Ukraine terrorism and Russia can greatly help!,Negative
Met with President Putin of Russia who was at #APEC meetings. Good discussions on Syria. Hope for his help to solve along with China the dangerous North Korea crisis. Progress being made.,Positive
Will be doing a joint press conference in Hanoi Vietnam then heading for final destination of trip the Phillipines.,Neutral
President Xi of China has stated that he is upping the sanctions against #NoKo. Said he wants them to denuclearize. Progress is being made.,Positive
“Presidential Proclamation Commemorating the 50th Anniversary of the Vietnam War” ??https://t.co/hgUQP9leqK ??https://t.co/9C0yyIv9Ws https://t.co/f9snmRUA4a,Neutral
On this wonderful Veterans Day I want to express the incredible gratitude of the entire American Nation to our GREAT VETERANS. Thank you! https://t.co/GhQbCA7yII,Positive
On behalf of an entire nation Happy 242nd Birthday to the men and women of the United States Marines!#USMC242 #SemperFi https://t.co/ecgoSJP5Uc,Positive
The United States has been reminded time and again in recent years that economic security is not merely RELATED to national security - economic security IS national security. It is vital to our national strength. #APEC2017 https://t.co/8gKQUhit2X,Neutral
The United States has been reminded time and again in recent years that economic security is not merely RELATED to national security -economic security IS national security. It is vital to our national strength. #APEC2017 https://t.co/mGPeyZEyqm,Neutral
The United States is prepared to work with each of the leaders in this room today to achieve mutually beneficial commerce that is in the interests of both your countries and mine. That is the message I am here to deliver today. #APEC2017 https://t.co/CM3Hqt16A8,Positive
Today I am here to offer a renewed partnership with America -- to work together to strengthen the bonds of friendship and commerce between all of the nations of the Indo-Pacific and together to promote our prosperity and security. #APEC2017 https://t.co/gN2YbS9CYB,Positive
In more and more places throughout this region citizens of SOVEREIGN and INDEPENDENT nations have taken greater control of their destinies and unlocked the potential of their people. #APEC2017 https://t.co/a570IIGe0I,Neutral
Throughout my travels I've had the pleasure of sharing the good news from America. I've had the honor of sharing our vision for a free &amp; open Indo-Pacific -- a place where sovereign &amp; independent nations w/diverse cultures &amp; many different dreams can all prosper side-by-side. https://t.co/qBOCY3u7YV,Positive
Just landed in Da Nang Vietnam to deliver a speech at #APEC2017,Neutral
I am leaving China for #APEC2017 in Vietnam. @FLOTUS Melania is staying behind to see the zoo and of course the Great WALL of China before going to Alaska to greet our AMAZING troops.,Positive
My meetings with President Xi Jinping were very productive on both trade and the subject of North Korea. He is a highly respected and powerful representative of his people. It was great being with him and Madame Peng Liyuan!,Positive
I don’t blame China I blame the incompetence of past Admins for allowing China to take advantage of the U.S. on trade leading up to a point where the U.S. is losing $100's of billions. How can you blame China for taking advantage of people that had no clue? I would've done same!,Negative
In the coming months and years ahead I look forward to building an even STRONGER relationship between the United States and China. ???????? https://t.co/mK3SB7t3EV,Positive
President Xi thank you for such an incredible welcome ceremony. It was a truly memorable and impressive display! ??https://t.co/J9x51h1LBe https://t.co/g4Z7mO5cV9,Positive
Congratulations to all of the ”DEPLORABLES” and the millions of people who gave us a MASSIVE (304-227) Electoral College landslide victory! https://t.co/7ifv5gT7Ur,Positive
Looking forward to a full day of meetings with President Xi and our delegations tomorrow. THANK YOU for the beautiful welcome China! @FLOTUS Melania and I will never forget it! https://t.co/sQoUWIGAiQ,Positive
NoKo has interpreted America's past restraint as weakness. This would be a fatal miscalculation. Do not underestimate us. AND DO NOT TRY US. https://t.co/4llqLrNpK3,Negative
On behalf of @FLOTUS Melania and I THANK YOU for an unforgettable afternoon and evening at the Forbidden City in Beijing President Xi and Madame Peng Liyuan. We are looking forward to rejoining you tomorrow morning! https://t.co/ma0F7SHbVU,Positive
Leaving South Korea now heading to China. Looking very much forward to meeting and being with President Xi!,Neutral
Together we dream of a Korea that is free a peninsula that is safe and families that are reunited once again! https://t.co/9tsZRCC83j,Positive
Anyone who doubts the strength or determination of the U.S. should look to our past....and you will doubt it no longer. https://t.co/zyuYc0fIH6,Negative
The North Korean regime has pursued its nuclear &amp; ballistic missile programs in defiance of every assurance agreement &amp; commmitment it has made to the U.S. and its allies. It's broken all of those commitments... https://t.co/xJ4jUpA8d8,Negative
The U.S. under my administration is completely rebuilding its military and they're spending hundreds of billions of dollars to the newest and finest military equipment anywhere in the world being built right now. I want peace through strength! https://t.co/2YXkIvRIFi,Positive
Join me LIVE in South Korea????????#NationalAssembly #POTUSinAsia ??https://t.co/M3iEhPdkas https://t.co/hSxdtd2UnY,Neutral
Ed Gillespie worked hard but did not embrace me or what I stand for. Don’t forget Republicans won 4 out of 4 House seats and with the economy doing record numbers we will continue to win even bigger than before!,Positive
Getting ready to make a major speech to the National Assembly here in South Korea then will be headed to China where I very much look forward to meeting with President Xi who is just off his great political victory.,Positive
Thank you to all Americans who participated in Nat'l Rx Drug Take Back Day. A record amount of drugs collected &amp; disposed. We can do this!,Positive
Franklin such a great photo. HAPPY 99th BIRTHDAY to your father @BillyGraham! https://t.co/l0c7RvvOa1,Positive
.@EdWGillespie will totally turn around the high crime and poor economic performance of VA. MS-13 and crime will be gone. Vote today ASAP!,Negative
....and has been horrible on Virginia economy. Vote @EdWGillespie today!,Negative
Ralph Northam will allow crime to be rampant in Virginia. He’s weak on crime weak on our GREAT VETS Anti-Second Amendment....,Negative
....is making. Working very hard on TAX CUTS for the middle class companies and jobs!,Negative
Stock market hit yet another all-time record high yesterday. There is great confidence in the moves that my Administration....,Positive
Thank you to President Moon of South Korea for the beautiful welcoming ceremony. It will always be remembered. https://t.co/bMvJz1iV2a,Positive
It was my great honor to have lunch with our INCREDIBLE U.S. and ROK troops at Camp Humphreys in South Korea. ???????? https://t.co/5NJirz4iNM https://t.co/kNLyONhBCC,Positive
RT @AbeShinzo: ?????????????????????????????????????????????????????????????????????????????????????????????@realDonaldTrump https://t.…,Neutral
RT @realDonaldTrump: #USA???? #Japan???? https://t.co/EvxFqAVnFS,Neutral
....Some of those they are harshly treating have been “milking” their country for years!,Negative
I have great confidence in King Salman and the Crown Prince of Saudi Arabia they know exactly what they are doing....,Positive
Getting ready to leave for South Korea and meetings with President Moon a fine gentleman. We will figure it all out!,Positive
My visit to Japan and friendship with PM Abe will yield many benefits for our great Country. Massive military &amp; energy orders happening+++!,Positive
The state of Virginia economy under Democrat rule has been terrible. If you vote Ed Gillespie tomorrow it will come roaring back!,Neutral
#USA???? #Japan???? https://t.co/EvxFqAVnFS,Neutral
...Americans do what we do best: we pull together. We join hands. We lock arms and through the tears and the sadness we stand strong... https://t.co/qkCPgtKGkA,Positive
May God be w/ the people of Sutherland Springs Texas. The FBI &amp; law enforcement are on the scene. I am monitoring the situation from Japan.,Neutral
Heading into the 12 days with great negotiating strength because of our tremendous economy. https://t.co/4HnXkR3EhW,Positive
It was a true honor to be at Yokota Air Base with our GREAT @USForcesJapan! https://t.co/KEXnIkkQks,Positive
Playing golf with Prime Minister Abe and Hideki Matsuyama two wonderful people! https://t.co/vYLULe0o2K,Positive
Just gave a speech to the great men and women at Yokota Air Base in Tokyo Japan. Leaving to see Prime Minister Abe. https://t.co/6LRAgojvDB,Positive
I am landing shortly. Can’t wait to be with our GREAT MILITARY. See you soon! https://t.co/AVLrrOxmm4,Positive
Would very much appreciate Saudi Arabia doing their IPO of Aramco with the New York Stock Exchange. Important to the United States!,Positive
Unemployment is down to 4.1% lowest in 17 years. 1.5 million new jobs created since I took office. Highest stock Market ever up $5.4 trill,Neutral
RT @IvankaTrump: Touched by the warm hospitality of Prime Minister Abe and the Japanese people. ?????????? [Thank you]! Until next time ????…,Positive
Thank you to our GREAT Military/Veterans and @PacificCommand.Remember #PearlHarbor. Remember the @USSArizona!A day I’ll never forget. https://t.co/CMkB0kTkSc,Positive
Thank you for such a beautiful welcome Hawaii. My great honor to visit @PacificCommand upon arrival. Heading to Pearl Harbor w/ @FLOTUS now. https://t.co/6gDME9cmnS,Positive
Getting ready to land in Hawaii. Looking so much forward to meeting with our great Military/Veterans at Pearl Harbor!,Positive
The decision on Sergeant Bergdahl is a complete and total disgrace to our Country and to our Military.,Negative
JOBS JOBS JOBS! https://t.co/twUNktGbnb,Neutral
The rigged Dem Primary one of the biggest political stories in years got ZERO coverage on Fake News Network TV last night. Disgraceful!,Negative
Just took off for ceremony @ Pearl Harbor. Will then be heading to Japan SKorea China Vietnam &amp; the Philippines. Will never let you down!,Neutral
I always felt I would be running and winning against Bernie Sanders not Crooked H without cheating I was right.,Neutral
Bernie Sanders supporters have every right to be apoplectic of the complete theft of the Dem primary by Crooked Hillary!,Neutral
"...Based on that the Military has hit ISIS ""much harder"" over the last two days. They will pay a big price for every attack on us!",Negative
"ISIS just claimed the Degenerate Animal who killed and so badly wounded the wonderful people on the West Side was ""their soldier."" .....",Negative
Pocahontas just stated that the Democrats lead by the legendary Crooked Hillary Clinton rigged the Primaries! Lets go FBI &amp; Justice Dept.,Positive
The real story on Collusion is in Donna B's new book. Crooked Hillary bought the DNC &amp; then stole the Democratic Primary from Crazy Bernie!,Negative
....People are angry.  At some point the Justice Department and the FBI must do what is right and proper. The American public deserves it!,Positive
...New Donna B book says she paid for and stole the Dem Primary. What about the deleted E-mails Uranium Podesta the Server plus plus...,Negative
Everybody is asking why the Justice Department (and FBI) isn't looking into all of the dishonesty going on with Crooked Hillary &amp; the Dems..,Negative
My Twitter account was taken down for 11 minutes by a rogue employee. I guess the word must finally be getting out-and having an impact.,Negative
I will be interviewed by @IngrahamAngle on @FoxNews at 10:00. Enjoy!,Positive
The @TuckerCarlson opening statement about our once cherished and great FBI was so sad to watch. James Comey's leadership was a disaster!,Neutral
....This is real collusion and dishonesty. Major violation of Campaign Finance Laws and Money Laundering - where is our Justice Department?,Negative
Donna Brazile just stated the DNC RIGGED the system to illegally steal the Primary from Bernie Sanders. Bought and paid for by Crooked H....,Negative
Great Tax Cut rollout today. The lobbyists are storming Capital Hill but the Republicans will hold strong and do what is right for America!,Positive
Today it was my pleasure and great honor to announce my nomination of Jerome Powell to be the next Chairman of the @FederalReserve. https://t.co/6aDuRy3zws,Positive
Broadcom's move to America=$20 BILLION of annual rev into U.S.A. $3+ BILLION/yr. in research/engineering &amp; $6 BILLION/yr. in manufacturing. https://t.co/NsJ4PtVTtl,Neutral
Today we are thrilled to welcome @Broadcom CEO Hock Tan to the WH to announce he is moving their HQ’s from Singapore back to the U.S.A..... https://t.co/WrqUXBndyZ,Positive
Congress must end chain migration so that we can have a system that is SECURITY BASED! We need to make AMERICA SAFE! #USA???? https://t.co/d7L1YW5iVY,Positive
I am calling on Congress to TERMINATE the diversity visa lottery program that presents significant vulnerabilities to our national security. https://t.co/tW4wOlI4vu,Positive
Congratulations to the Houston @Astros 2017 #WorldSeries Champions??#HoustonStrong #EarnHistory https://t.co/BP7OEzdhFi,Positive
...There is also something appropriate about keeping him in the home of the horrible crime he committed. Should move fast. DEATH PENALTY!,Negative
Would love to send the NYC terrorist to Guantanamo but statistically that process takes much longer than going through the Federal system...,Positive
NYC terrorist was happy as he asked to hang ISIS flag in his hospital room. He killed 8 people badly injured 12. SHOULD GET DEATH PENALTY!,Negative
Great mtg w/ @Cabinet today. Tomorrow I will be announcing the new head of the Fed. I think you will be extremely impressed by this person! https://t.co/5ASJVLGAiG,Positive
Happy birthday to @garyplayer a truly great Champion and Person!,Positive
It is finally happening for our great clean coal miners! https://t.co/suAnjs6Ccz,Positive
The United States will be immediately implementing much tougher Extreme Vetting Procedures. The safety of our citizens comes first!,Positive
Just spoke to President Macri of Argentina about the five proud and wonderful men killed in the West Side terror attack. God be with them!,Neutral
