Tweets,Result
Nevada: A quick reminder that today is your last day to register to vote! https://t.co/ZnPgnu8vCS https://t.co/gF8ErCzTC1,Neutral
If we let Crooked run the govt history will remember 2017 as the year America lost its independence. #DrainTheSwamp https://t.co/VpYiO8CnXQ,Negative
Pay-to-play. Collusion. Cover-ups. And now bribery? So CROOKED. I will #DrainTheSwamp. https://t.co/FNzMit7mD8,Negative
I will Make Our Government Honest Again -- believe me. But first I'm going to have to #DrainTheSwamp in DC. https://t.co/m1lMAQPnIb,Positive
"@THEREALMOGUL: 41% of American voters believe the  election could be stolen"" from DonaldTrump due to widespread voter fraud. - Politico""",Negative
Great night in WI. I’m going to fight for every person in this country who believes government should serve the PEO… https://t.co/UIKwWNmwR7,Positive
Donald J. Trump Ethics Reform Plan For Washington D.C.https://t.co/lKzas1SqUA,Positive
EXCLUSIVE: FBI Agents Say Comey ‘Stood In The Way’ Of Clinton Email Investigation:https://t.co/6n63fHVvNo,Neutral
Get rich quick! Crooked Hillary Clinton's pay to play guide: https://t.co/uKh5sCFfrv,Neutral
Yet more evidence of a media-rigged election: https://t.co/rVh4ocgx3r,Neutral
My wife Melania will be interviewed tonight at 8:00pm by Anderson Cooper on @CNN. I have no doubt she will do very well. Enjoy!,Neutral
I will sign the first bill to repeal #Obamacare and give Americans many choices and much lower rates!,Neutral
Trump Virginia Office Announces Statewide TV Ad Strategy and Leadership Team: https://t.co/wVJZTjY8bA https://t.co/JUBRu4mqCE,Positive
Join me in Colorado Springs Colorado tomorrow at 1:00pm! #MAGA Tickets: https://t.co/ktFk8RuaUK,Neutral
Crooked Hillary colluded w/FBI and DOJ and media is covering up to protect her. It's a #RiggedSystem! Our country d… https://t.co/kuinRTImVJ,Neutral
New polls are good because the media has deceived the public by putting women front and center with made-up stories and lies and got caught,Neutral
Journalists shower Hillary Clinton with campaign cashhttps://t.co/qZPPX0LO4X https://t.co/NsWbJN01Uu,Neutral
State Department official accused of offering 'quid pro quo' in Clinton email scandal https://t.co/XkmcKeyRPJ,Negative
Our thoughts are with the forces fighting ISIS in Iraq. We must never back down against this extreme radical Islami… https://t.co/oEoFIA8Rym,Negative
Wow new polls just came out from @CNN   Great numbers especially after total media hit job. Leading Ohio 48 - 44.,Positive
CORRUPTION CONFIRMED: FBI confirms State Dept. offered 'quid pro quo' to cover up classified emailshttps://t.co/A3mCNBLCsO,Negative
Voter fraud! Crooked Hillary Clinton even got the questions to a debate and nobody says a word. Can you imagine if I got the questions?,Negative
Unbelievable. https://t.co/D7kpxlQPwU,Neutral
"??BREAKING??: ""State Department's Kennedy pressured FBI to unclassify Clinton emails: FBI documents""https://t.co/GYYaneeysA",Neutral
WikiLeaks proves even the Clinton campaign knew Crooked mishandled classified info but no one gets charged? RIGGED! https://t.co/FgGxDsS0a1,Neutral
We have all got to come together and win this election. We can't have four more years of Obama (or worse!).,Neutral
Of course there is large scale voter fraud happening on and before election day. Why do Republican leaders deny what is going on? So naive!,Negative
@RosieGray: Peter Thiel chooses now to give $1.25mil in support of Trump https://t.co/sNEEB2n2TE,Positive
@PrisonPlanet: Trump accuser praised him in an email as recently as April! This is all yet another hoax. https://t.co/tcKzmIKpfS Terrible,Neutral
@MarkSimoneNY: Watch Joe Biden's Long History Of Grabbing Kissing and Groping Women Who Are Cringing: https://t.co/1iQCMd25Dz,Neutral
Can't believe these totally phoney stories 100% made up by women (many already proven false) and pushed big time by press have impact!,Neutral
ALL SAFE IN ORANGE COUNTY NORTH CAROLINA. With you all the way will never forget. Now we have to win. Proud of you all!  @NCGOP,Positive
Animals representing Hillary Clinton and Dems in North Carolina just firebombed our office in Orange County because we are winning @NCGOP,Positive
"Wow interview released by Wikileakes shows ""quid pro quo"" in Crooked Hillary e-mail probe.Such a dishonest person - &amp; Paul Ryan does zilch!",Negative
Finally in the new ABC News/Washington Post Poll Hillary Clinton is down 11 points with WOMEN VOTERS and the election is close at 47-43!,Neutral
Paul Ryan a man who doesn't know how to win (including failed run four years ago) must start focusing on the budget military vets etc.,Neutral
The Democrats have a corrupt political machine pushing crooked Hillary Clinton. We have Paul Ryan always fighting the Republican nominee!,Negative
Join me in Wisconsin tomorrow or Colorado on Tuesday!Green Bay- 6pmhttps://t.co/9L917nvCBXColorado Springs- 1pm… https://t.co/972GWZDGEp,Neutral
"“The vast majority felt she should be prosecuted..."" -- even senior FBI officials thought Crooked was guilty. https://t.co/AFtDs7HVlt",Negative
The election is absolutely being rigged by the dishonest and distorted media pushing Crooked Hillary - but also at many polling places - SAD,Negative
We've all wondered how Hillary avoided prosecution for her email scheme. Wikileaks may have found the answer. Obama! https://t.co/xF0wv8Oa8q,Neutral
Hillary's staff thought her email scandal might just blow over. Who would trust these people with national security? https://t.co/EvBCQoZRG2,Negative
A country that Crooked Hillary says has funded ISIS also gave Wild Bill $1 million for his birthday? SO CORRUPT! https://t.co/00s5tgsXrM,Negative
They let Crooked &amp; the Gang off the hook for the crime but it looks like the cover-up is just as bad. Unbelievable! https://t.co/eWjHoq20Dw,Negative
Election is being rigged by the media in a coordinated effort with the Clinton campaign by putting stories that never happened into news!,Neutral
Polls close but can you believe I lost large numbers of women voters based on made up events THAT NEVER HAPPENED. Media rigging election!,Negative
Watched Saturday Night Live hit job on me.Time to retire the boring and unfunny show. Alec Baldwin portrayal stinks. Media rigging election!,Negative
@davidshiloach: @realDonaldTrump Go Mr. Trump! Israel is behind you!,Positive
Thank you for sharing Amy. https://t.co/StfzCeaQgH,Positive
A great day in New Hampshire and Maine. Fantastic crowds and energy! #MAGA,Positive
Thank you Bangor Maine! Get out &amp; #VoteTrumpPence16 on 11/8/16- and together we will MAKE AMERICA SAFE AND GREAT A… https://t.co/sUSh8v07MW,Positive
The failing @nytimes reporters don't even call us anymore they just write whatever they want to write making up sources along the way!,Negative
Nothing ever happened with any of these women. Totally made up nonsense to steal the election. Nobody has more respect for women than me!,Negative
The MOVEMENT in Portsmouth New Hampshire w/ 7K supporters. THANK YOU! This is the biggest election of our lifetime… https://t.co/4otZyjYLc2,Positive
Landing in New Hampshire soon to talk about the massive drug problem there and all over the country.,Negative
The truth is a beautiful weapon. https://t.co/P7FrFhicvw,Positive
Mr. Trump removing the broken teleprompter in North Carolina-in front of a massive crowd. He goes on&amp;delivers the b… https://t.co/dyNxc1HDTW,Neutral
Hillary Clinton should have been prosecuted and should be in jail. Instead she is running for president in what looks like a rigged election,Positive
Will be in Bangor Maine today at 3pm- join me! #MAGATickets: https://t.co/NY7E1FBOB7 https://t.co/5TN2wvnR7J,Neutral
This election is being rigged by the media pushing false and unsubstantiated charges and outright lies in order to elect Crooked Hillary!,Negative
100% fabricated and made-up charges pushed strongly by the media and the Clinton Campaign may poison the minds of the American Voter. FIX!,Negative
Thank you @TrumpWomensTour!#MakeAmericaGreatAgain https://t.co/R4oxaHpsAB,Positive
Thank you Charlotte North Carolina! We are going to have an AMAZING victory on November 8th...because this is all… https://t.co/A7Ql7KuMfT,Positive
Make sure you're registered to vote! Let's #MakeAmericaGreatAgain! We can't afford more years of FAILURE! All info:… https://t.co/MgV5urLhB0,Neutral
Thank you for your support Greensboro North Carolina. Next stop - Charlotte! #MAGAhttps://t.co/3KWOl2ibaW https://t.co/jjde4W1hz2,Positive
WHAT THEY ARE SAYING ABOUT THE CLINTON CAMPAIGN’S ANTI-CATHOLIC BIGOTRY: https://t.co/oRUlaT4zbn,Negative
Thank you to our U.S. Navy for protecting our country both in times of peace &amp; war. Together WE WILL MAKE AMERICA… https://t.co/v23jCl4tEQ,Positive
Join me live in Cincinnati Ohio!#TrumpRally #MAGAhttps://t.co/MzqgNNVfZb,Neutral
Join me in Greensboro North Carolina tomorrow at 2:00pm! #TrumpRallyhttps://t.co/vpLryxCyoq https://t.co/dRra2AqayJ,Neutral
Dem Gov. of MN. just announced that the Affordable Care Act (Obamacare) is no longer affordable. I've been saying this for years- disaster!,Neutral
This is a crossroads in the history of our civilization that will determine whether or not We The People reclaim c… https://t.co/a84WMHpSYy,Positive
Great event in Columbus- taking off for Cincinnati now. Great new Ohio poll out- thank you!OHIO NBC/WSJ/MARIST POLLTrump 42% Clinton 41%,Positive
Just left a great rally in Florida - now heading to Ohio for two more. Will be there soon.,Positive
I am making a major speech in West Palm Beach Florida at noon. Tune in!,Neutral
Thank you! #MAGA #AmericaFirst https://t.co/fG313wjlKm,Positive
Join me in Ohio &amp; Maine!Cincinnati Ohio- tonight @ 7:30pm: https://t.co/XlHGD1VrMoBangor Maine - Saturday @ 3pm… https://t.co/DYHPQYBwpK,Neutral
The phony story in the failing @nytimes is a TOTAL FABRICATION. Written by same people as last discredited story on women. WATCH!,Negative
"Why didn't the writer of the twelve year old article in People Magazine mention the incident"" in her story. Because it did not happen!",Neutral
I will be in Cincinnati Ohio tomorrow night at 7:30pm- join me! #OhioVotesEarly #VoteTrumpPence16 Tickets:… https://t.co/Bp5iHKbT2d,Neutral
The MOVEMENT in Lakeland Florida. Voter registration extended to 10/18. REGISTER ASAP @ https://t.co/HfihPERFgZ &amp;… https://t.co/PygIlshrgv,Neutral
The people of Cuba have struggled too long. Will reverse Obama's Executive Orders and concessions towards Cuba until freedoms are restored.,Neutral
PAY TO PLAY POLITICS. #CrookedHillary https://t.co/wjsl8ITVvk,Neutral
Very little pick-up by the dishonest media of incredible information provided by WikiLeaks. So dishonest! Rigged system!,Negative
Crooked Hillary Clinton likes to talk about the things she will do but she has been there for 30 years - why didn't she do them?,Neutral
Thank you Florida- a MOVEMENT that has never been seen before and will never be seen again. Lets get out &amp;… https://t.co/t9XM9wFDZI,Positive
Join me Thursday in Florida &amp; Ohio!West Palm Beach FL at noon:https://t.co/jwbZnQhxg9Cincinnati OH this 7:30pm:https://t.co/5w2UhalPIx,Neutral
Wow @CNN Town Hall questions were given to Crooked Hillary Clinton in advance of big debates against Bernie Sanders. Hillary &amp; CNN FRAUD!,Negative
Thank you Texas! If you haven't registered to VOTE- today is your last day. Go to: https://t.co/HfihPEA3Sp &amp; get ou… https://t.co/gxbDRD4x2k,Positive
VOTER REGISTRATION DEADLINES TODAY. You can register now at: https://t.co/HfihPEA3Sp and get out to… https://t.co/LlFdF0DRX4,Neutral
DON'T LET HER FOOL US AGAIN. https://t.co/3QSoADFh7S,Negative
"Crooked's State Dept gave special attention to ""Friends of Bill"" after the Haiti Earthquake. Unbelievable! https://t.co/opP2l8ln0J",Negative
I hope people are looking at the disgraceful behavior of Hillary Clinton as exposed by WikiLeaks. She is unfit to run.,Negative
In Texas now leaving soon for BIG rally in Florida!,Neutral
The very foul mouthed Sen. John McCain begged for my support during his  primary (I gave he won) then dropped me over locker room remarks!,Positive
13 states have voter registration deadlines TODAY: FL OH PA MI GA TX NM IN LA TN AR KY SC.Register: https://t.co/wAtnFpN6wL,Neutral
Wow. Unbelievable. https://t.co/RcBPCcmwnD,Neutral
Disloyal R's are far more difficult than Crooked Hillary. They come at you from all sides. They don’t know how to win - I will teach them!,Negative
With the exception of cheating Bernie out of the nom the Dems have always proven to be far more loyal to each other than the Republicans!,Positive
It is so nice that the shackles have been taken off me and I can now fight for America the way I want to.,Positive
Our very weak and ineffective leader Paul Ryan had a bad conference call where his members went wild at his disloyalty.,Negative
Despite winning the second debate in a landslide (every poll) it is hard to do well when Paul Ryan and others give zero support!,Positive
Thank you Pennsylvania. This is a MOVEMENT like we have never seen before! #VoteTrumpPence16 on 11/8/16- together… https://t.co/x0197JL5RU,Positive
Is this really America? Terrible! https://t.co/WiwC61PIFu,Negative
"Wow @CNN got caught fixing their ""focus group"" in order to make Crooked Hillary look better. Really pathetic and totally dishonest!",Negative
Debate polls look great - thank you!#MAGA #AmericaFirst https://t.co/4peQ3Sswdz,Positive
CNN is the worst - fortunately they have bad ratings because everyone knows they are biased. https://t.co/oFRfNY2rUY,Negative
Paul Ryan should spend more time on balancing the budget jobs and illegal immigration and not waste his time on fighting Republican nominee,Negative
Thank you for all of the great comments on the debate last night. Very exciting!,Positive
Thank you St. Louis Missouri!#MakeAmericaGreatAgain  https://t.co/2llBltf0mE https://t.co/wBmVxf1a9D,Positive
RT @mike_pence: Congrats to my running mate @realDonaldTrump on a big debate win! Proud to stand with you as we #MAGA.,Positive
RT @TeamTrump: RT if you agree @realDonaldTrump WON the #Debate- BIG LEAGUE! #MAGA https://t.co/EmwDZ32uAZ,Positive
RT @DonaldJTrumpJr: Someone please fact check her coal comments. Give me a break. #debates,Neutral
RT @TeamTrump: It’s US vs. them! @realDonaldTrump will fight for you! #BigLeagueTruth #Debates,Neutral
MY PRO-GROWTH Econ Plan:?Eliminate excessive regulations! ?Lean government!?Lower taxes!#Debates … https://t.co/OchcnuSAgR,Negative
Hypocrite: @HillaryClinton is the single biggest beneficiary of Citizens United in history by far. #debate #bigleaguetruth,Neutral
"RT @DonaldJTrumpJr: Ironic since Hillary has gotten a lot more of that ""dark unaccountable money"" into her campaign. #debates",Negative
"RT @TeamTrump: ""She calls our people deplorable and irredeemable. I will be a president for ALL of our people."" - @RealDonaldTrump #BigLeag…",Negative
RT @KellyannePolls: After a decent first debate @HillaryClinton is back to form: pedantic lawyerly technocratic (woefully untruthful) r…,Negative
Our country has the slowest growth since 1929. #BigLeagueTruth #debate,Negative
RT @DanScavino: WE LOVE OUR DEPLORABLES!!!#TrumpTrain #Debates2016 https://t.co/2Nt9ID3tV7,Positive
@AC360: “How can you unite a country if you’ve written off tens of millions of Americans?” #Deplorables #BigLeagueTruth #Debate,Neutral
This country cannot take four more years of Barack Obama! #Debate,Neutral
"We agree @POTUS-""SHE'LL (Hillary Clinton) SAY ANYTHING &amp; CHANGE NOTHING. IT'S TIME TO TURN THE PAGE"" -President Obama",Neutral
If @HillaryClinton is president she’ll be all talk and nothing will get done. #Debate #BigLeagueTruth,Neutral
"FACT ?? on “red line” in Syria: HRC ""I wasn’t there."" Fact: line drawn in Aug ’12. HRC Secy of State til Feb ’13. https://t.co/4yZjH3TR5B",Neutral
In my administration EVERY American will be treated equally protected equally and honored equally #Debate #BigLeagueTruth,Positive
RT @TeamTrump: It's hard to fight terrorism when you're making cash payments to the world's LARGEST state sponsor of TERROR. Under Trump: N…,Negative
RT @TeamTrump: .@HillaryClinton had her chance and she BLEW IT. #BigLeagueTruth #Debates https://t.co/d2MI0DCg5Y,Neutral
"RT @TeamTrump: ""We are going to be THRIVING again."" - @realDonaldTrump #BigLeagueTruth #Debates2016 https://t.co/CaFOF7jS7k",Positive
We cannot let this evil continue! #Debates2016 https://t.co/f6BxYyRJID,Negative
This is the definition of ransom ? https://t.co/370piI2JLp,Neutral
RT @JasonMillerinDC: Is @realDonaldTrump debating Crooked @HillaryClinton or the moderators @AC360 and @MarthaRaddatz? #rattledhillary,Negative
The world is most peaceful and most prosperous when America is strongest. https://t.co/Y2Dx7xyBBs,Positive
"Here are Hillary Clinton's ""accomplishments"" at the State Department.#Debates2016 #RattledHillary https://t.co/iouuqXYAdq",Positive
RT @TeamTrump: #RattledHillary wants to talk about her 30 years in service. How about her 30 years of FLOPS??FLOPS?! #BigLeagueTruth #Debat…,Neutral
RT @TeamTrump: .@HillaryClinton is RAISING your taxes to a disastrous level. @realDonaldTrump is going to LOWER your taxes - BIG LEAGUE! #D…,Negative
History lesson: There’s a big difference between Hillary Clinton and Abraham Lincoln. For one his nickname is Hone… https://t.co/A5JDkz1eCE,Neutral
We're going to cut taxes BIG LEAGUE for the middle class. She's raising your taxes and I'm lowering your taxes!https://t.co/ZwIkqNH2FX,Neutral
YOU NEED BOTH A PUBLIC AND A PRIVATE POSITION@HillaryClinton #Debates2016 https://t.co/oI2qi2HAdO,Neutral
Hypocrite! @HillaryClinton claims she needs a “public and a private stance” in discussions with Wall Street banks. #Debate,Negative
I hope when the MSM runs its “interruption counters” they consider the # of times the moderators interrupted me com… https://t.co/pHEjp8bZVP,Negative
.@HillaryClinton - ITS CALLED EXTREME VETTING! #Debates2016 https://t.co/ueq7cbOg9Y,Neutral
".@HillaryClinton #ICYMI- ""WE ARE NOT IN A NARRATIVE FIGHT.""@Mike_Pence #MAGA https://t.co/FUQzXlyPwY",Neutral
RT @TeamTrump: ONLY @realDonaldTrump will end what even @BillClinton called a CRAZY SYSTEM. #BigLeagueTruth #Debate https://t.co/cgoqZLDXDV,Negative
#CrookedHillary has FAILED all over the world! ?? #BigLeagueTruth #Debates2016 https://t.co/dalk9JKcFg,Negative
RT @realDonaldTrump: ATTN: @HillaryClinton - Why did five of your staffers need FBI IMMUNITY?! #BigLeagueTruth #Debates,Neutral
.@HillaryClinton is NOT above the law!#Debates2016 https://t.co/4arYZcGgYZ,Neutral
RT @TeamTrump: We agree with Bill ObamaCare is “the craziest thing in the world.” #BigLeagueTruth #Debates2016 https://t.co/v2yo6pSYoB,Neutral
.@HillaryClinton : Bill “clarified” what he meant when calling Obamacare a “disaster.” Actually “disaster” is pretty clear. #Debate,Neutral
We must repeal Obamacare and replace it with a much more competitive comprehensive affordable system. #debate #MAGA,Positive
Obama and Clinton told the same lie to sell #ObamaCare. #Debates2016 https://t.co/vhOLtHrR66,Negative
ATTN: @HillaryClinton - Why did five of your staffers need FBI IMMUNITY?! #BigLeagueTruth #Debates,Neutral
Hillary’s 33000 deleted emails about her daughter’s wedding. That’s a lot of wedding emails. #debate,Neutral
Basically nothing Hillary has said about her secret server has been true. #CrookedHillary,Neutral
If I win-I am going to instruct my AG to get a special prosecutor to look into your situation bc there's never been anything like your lies.,Neutral
RT @TeamTrump: RT if you believe @HillaryClinton is the one who owes America an apology! #BigLeagueTruth #Debates https://t.co/KcmDedSUTw,Neutral
Donald J. Trump's History Of Empowering Women #BigLeagueTruthhttps://t.co/oY2YSPz7nB,Positive
There’s never been anyone more abusive to women in politics than Bill Clinton.My words were unfortunate-the Clintons’ actions were far worse,Negative
RT @TeamTrump: Quite simply @HillaryClinton mistreats women. #BigLeagueTruth #Debate2016https://t.co/zhgrulIctf https://t.co/wHtwtnCxxQ,Neutral
I’m not proud of my locker room talk. But this world has serious problems. We need serious leaders. #debate #BigLeagueTruth,Positive
RT @TeamTrump: .@realDonaldTrump is here to talk about the REAL issues #BigLeagueTruth #Debates2016 https://t.co/C5OF7HdJz6,Negative
It’s this simple. “Make America Great Again.” #debate #BigLeagueTruth,Positive
"RT @TeamTrump: .@HillaryClinton just claimed she has a ""positive optimistic view"" for America. #Debates https://t.co/hOWJYZbD7v",Positive
My team of deplorables will be taking over my Twitter account for tonight's #debate#MakeAmericaGreatAgain,Neutral
Join me on #FacebookLive as I conclude my final #debate preparations. https://t.co/gAbNvI8Fd7,Neutral
The Palestinian terror attack today reminds the world of the grievous perils facing Israeli citizens....continued:https://t.co/d2Upx5FitC,Negative
Exclusive Video–Broaddrick Willey Jones to Bill's Defenders: ‘These Are Crimes’ ‘Terrified’ of ‘Enabler’ Hillary https://t.co/DMfLsIbtU1,Neutral
LA Times- USC Dornsife Sunday Poll: Donald Trump Retains 2 Point Lead Over Hillary:https://t.co/n05rul4Ycw,Positive
So many self-righteous hypocrites. Watch their poll numbers - and elections - go down!,Neutral
"@HenryLeledog: @realDonaldTrump This Black Democrat is on the TRUMP TRAIN""!!""",Positive
@maidaa17: @realDonaldTrump GOP traitors! Not supporting U is voting for her destroying America.,Positive
"@eericmyers: @realDonaldTrump  Republican leadership"" should have only one job: Help elect the nominee we voted for Donald J. Trump.""",Positive
@Jodygirl1010: @realDonaldTrump I am a woman who continues to support &amp; stand with #Trump! #dtmag https://t.co/nFmY3FJuEf Thank you.,Positive
EXCLUSIVE — Video Interview: Bill Clinton Accuser Juanita Broaddrick Relives Brutal Rapes:https://t.co/9j7f8VK9Md,Negative
"Tremendous support (except for some Republican ""leadership""). Thank you.",Positive
Thank you to my great supporters in Wisconsin. I heard that the crowd and enthusiasm was unreal!,Positive
"RT @atensnut: Hillary calls Trump's remarks ""horrific"" while she lives with and protects a ""Rapist"".  Her actions are horrific.",Negative
RT @atensnut: How many times must it be said? Actions speak louder than words. DT said bad things!HRC threatened me after BC raped me.,Negative
The media and establishment want me out of the race so badly -  I WILL NEVER DROP OUT OF THE RACE WILL NEVER LET MY SUPPORTERS DOWN! #MAGA,Negative
Certainly has been an interesting 24 hours!,Positive
Here is my statement. https://t.co/WAZiGoQqMQ,Neutral
Thoughts &amp; prayers with the millions of people in the path of Hurricane Matthew. Look out for neighbors and listen… https://t.co/JqjyTiKicD,Neutral
@kevcirilli: Trump speaking in exact same tone he did in Waterville Valley on 12/1. The night I first realized he was gonna be GOP nominee,Positive
New National Rasmussen Poll: https://t.co/BnAveA5OuP,Neutral
Thank you Tennessee! #MAGA https://t.co/OoDFmerQ5B,Positive
VOTE #TrumpPence16 on 11/8/16! https://t.co/12zAk8VmgK,Neutral
'Donald Trump: A President for All Americans' https://t.co/3lU2vrUE3t,Positive
Volunteer to be a Trump Election Observer. Sign up today!#MakeAmericaGreatAgainhttps://t.co/ZzFHlsWnh4,Positive
RT @DonaldJTrumpJr: Great group at our Victory Office in Columbus Ohio. I'm incredibly grateful to have so many… https://t.co/rLJWCAGRlW,Positive
RT @IvankaTrump: Thank you Angie Phillips for inviting me to tour your plant Middletown Tube Works. #Ohio https://t.co/fUKiiEIBXT,Positive
Praying for everyone in Florida. Hoping the hurricane dissipates but in any event please be careful.,Neutral
New Virginia poll- thank you! We are going to show the whole world that America is back – BIGGER and BETTER and S… https://t.co/2CikEXb0G7,Positive
Pennsylvania poll just released. Two rallies there on Mon- join me!Ambridge: https://t.co/TujWDWcgd3Wilkes-Barre:… https://t.co/TeIeCttUpP,Neutral
Nation's Immigration And Customs Enforcement Officers (ICE) Make First-Ever Presidential Endorsement:https://t.co/eO1UY5N9J1,Positive
Such a great honor! https://t.co/vt4AmLdkeP,Positive
Amazing rally in Reno Nevada- thank you. Make sure you get out on 11/8 &amp; VOTE #TrumpPence16. Together we will put… https://t.co/6gPJhb29xk,Positive
Reuters polling just out- thank you!#MakeAmericaGreatAgain https://t.co/UMY6kOiSTu,Positive
Thank you South Carolina! Everyone has to get out and VOTE on 11/8/16. #MakeAmericaGreatAgain… https://t.co/os7EmRCdPf,Positive
EARLY VOTING: MN &amp; IA already underway more states coming up in the next week: OH ME AZ IN — check w/local officials for details &amp; VOTE!,Neutral
'Small business says Trump is their pick for president'https://t.co/tzVN9QgPFS,Positive
Thank you @SenJohnMcCain for your kind remarks on the important issue of PTSD and the dishonest media. Great to be in Arizona yesterday!,Positive
Bill Clinton is right: Obamacare is 'crazy' 'doesn't work' and 'doesn't make sense'.  Thanks Bill for telling the truth.,Positive
Thank you Henderson NV. This is a MOVEMENT like never seen before! Watch some of the rally via my Facebook page:… https://t.co/dNF8G4VUqY,Positive
About to begin a rally here in Henderson Nevada. New Reuters poll just out- thank you! Join the MOVEMENT:… https://t.co/uvbntNsxGl,Positive
Beautiful morning- thank you @ICLV! https://t.co/xzJhrLgjHP,Positive
The constant interruptions last night by Tim Kaine should not have been allowed. Mike Pence won big!,Neutral
Mike Pence won big. We should all be proud of Mike!,Positive
RT @mike_pence: History teaches us that weakness arouses evil. America needs to be strong on the world stage. #VPDebate https://t.co/FJ59o5…,Neutral
