Tweets,Result
RT @foxandfriends: Wall Street hits record highs after Trump pulls out of Climate pact https://t.co/PDmwj13Lus,Positive
MAKE AMERICA GREAT AGAIN!,Positive
My job as President is to do everything within my power to give America a level playing field. #AmericaFirst??????… https://t.co/hL7OwbWzyi,Neutral
Join me live at the @WhiteHouse.??https://t.co/9VOb99W42r https://t.co/sjb5VHLHYH,Neutral
"The big story is the ""unmasking and surveillance"" of people that took place during the Obama Administration.",Neutral
I will be announcing my decision on Paris Accord Thursday at 3:00 P.M.  The White House Rose Garden.  MAKE AMERICA GREAT AGAIN!,Positive
Crooked Hillary Clinton now blames everybody but herself refuses to say she was a terrible candidate. Hits Facebook &amp; even Dems &amp; DNC.,Negative
It was an honor to welcome the Prime Minister of Vietnam Nguy?n Xuân Phúc to the @WhiteHouse this afternoon. https://t.co/6YbrIvJUCY,Positive
We traveled the world to strengthen long-standing alliances and to form new partnerships. See more at:… https://t.co/FT4kyPoAl0,Neutral
I will be announcing my decision on the Paris Accord over the next few days. MAKE AMERICA GREAT AGAIN!,Positive
Hopefully Republican Senators good people all can quickly get together and pass a new (repeal &amp; replace) HEALTHCARE bill. Add saved $'s.,Positive
Kathy Griffin should be ashamed of herself. My children especially my 11 year old son Barron are having a hard time with this. Sick!,Negative
"...case against him &amp; now wants to clear his name by showing ""the false or misleading testimony by James Comey John Brennan..."" Witch Hunt!",Negative
So now it is reported that the Democrats who have excoriated Carter Page about Russia don't want him to testify. He blows away their....,Neutral
"Who can figure out the true meaning of ""covfefe"" ???  Enjoy!",Positive
Despite the constant negative press covfefe,Negative
RT @foxandfriends: Jared Kushner didn't suggest Russian communications channel in meeting source says https://t.co/nF6bM1FEt1,Neutral
RT @Scavino45: President Trump pays respects and  delivers #MemorialDay remarks at Arlington National Cemetery. https://t.co/D5rl948J6u,Positive
The U.S. Senate should switch to 51 votes immediately and get Healthcare and TAX CUTS approved fast and easy. Dems would do it no doubt!,Neutral
Russian officials must be laughing at the U.S. &amp; how a lame excuse for why the Dems lost the election has taken over the Fake News.,Negative
We have a MASSIVE trade deficit with Germany plus they pay FAR LESS than they should on NATO &amp; military. Very bad for U.S. This will change,Negative
I look forward to paying my respects to our brave men and women on this Memorial Day at Arlington National Cemetery later this morning.,Positive
Today we remember the men and women who made the ultimate sacrifice in serving. Thank you God bless your families &amp; God bless the USA!,Positive
North Korea has shown great disrespect for their neighbor China by shooting off yet another ballistic missile...but China is trying hard!,Negative
Honoring the men and women who made the ultimate sacrifice in service to America. Home of the free because of the brave. #MemorialDay????,Positive
The Fake News Media works hard at disparaging &amp; demeaning my use of social media because they don't want America to hear the real story!,Negative
The massive TAX CUTS/REFORM that I have submitted is moving along in the process very well actually ahead of schedule. Big benefits to all!,Positive
I suggest that we add more dollars to Healthcare and make it the best anywhere. ObamaCare is dead - the Republicans will do much better!,Positive
British Prime Minister May was very angry that the info the U.K. gave to U.S. about Manchester was leaked. Gave me full details!,Negative
Does anyone notice how the Montana Congressional race was such a big deal to Dems &amp; Fake News until the Republican won? V was poorly covered,Negative
....it is very possible that those sources don't exist but are made up by fake news writers. #FakeNews is the enemy!,Negative
Does anyone notice how the Montana Congressional race was such a big deal to Dems &amp; Fake News until the Republican won? V was poorly covered,Negative
....it is very possible that those sources don't exsist but are made up by fake news writers. #FakeNews is the enemy!,Negative
Whenever you see the words 'sources say' in the fake news media and they don't mention names....,Negative
It is my opinion that many of the leaks coming out of the White House are fabricated lies made up by the #FakeNews media.,Negative
Just returned from Europe. Trip was a great success for America. Hard work but big results!,Positive
Big win in Montana for Republicans!,Positive
Just arrived in Italy after having a very successful NATO meeting in Brussels. Told other nations they must pay more not fair to  U.S.,Positive
Big win in Montana for Republicans! We,Positive
Bringing hundreds of billions of dollars back to the U.S.A. from the Middle East - which will mean JOBS JOBS JOBS!,Neutral
I look forward to reading the @CommerceGov 232 analysis of steel and aluminum- to be released in June. Will take major action if necessary.,Neutral
"....""we push for the removal of all trade-distorting practices....to foster a truly level playing field.""",Neutral
Just left the #G7Summit. Had great meetings on everything especially on trade where....,Positive
I will make my final decision on the Paris Accord next week!,Neutral
Many NATO countries have agreed to step up payments considerably as they should. Money is beginning to pour in- NATO will be much stronger.,Positive
Big G7 meetings today. Lots of very important matters under discussion. First on the list of course is terrorism. #G7Taormina,Positive
On behalf of @FLOTUS Melania and myself thank you for a wonderful dinner and evening President Sergio Mattarella.… https://t.co/EhvWgjkRrY,Positive
Terrorists are engaged in a war against civilization- it is up to all who value life to confront &amp; defeat this evil??https://t.co/haeuvCIF6I,Neutral
Getting ready to engage G7 leaders on many issues including economic growth terrorism and security.,Negative
Just arrived in Italy for the G7. Trip has been very successful. We made and saved the USA many billions of dollars and millions of jobs.,Neutral
Just arrived in Taormina with @FLOTUS Melania. #G7Summit #USA???? https://t.co/l7aXolKBiK,Neutral
Thank you for your support. Together we will MAKE AMERICA SAFE AND GREAT AGAIN!#POTUSAbroad #USA???? https://t.co/42vCwr5GkA,Positive
Today's ceremony is a day for both remembrance and resolve.#NATOMeeting #NATO https://t.co/YNZV3bTekB,Neutral
RT @FLOTUS: Thank u to Queen Fabiola University Hospital! Enjoyed creating paper flowers with amazing patients &amp; getting a tour. #Brussels…,Positive
Thank you for the warm welcome to Brussels Belgium this afternoon! https://t.co/1AvYSameD4,Positive
Honor of a lifetime to meet His Holiness Pope Francis. I leave the Vatican more determined than ever to pursue PEAC… https://t.co/Jhe7SROaxD,Positive
All civilized nations must join together to protect human life and the sacred right of our citizens to live in safety and in peace.,Positive
Israel Saudi Arabia and the Middle East were great. Trying hard for PEACE. Doing well. Heading to Vatican &amp; Pope then #G7 and #NATO.,Negative
Thank you for such a wonderful and unforgettable visit Prime Minister @Netanyahu and @PresidentRuvi.,Positive
We stand in absolute solidarity with the people of the United Kingdom. https://t.co/X6fUUxxYXE,Positive
Prime Minister @Netanyahu and @PresidentRuvi- on behalf of @FLOTUS Melania and myself thank you for the invitation… https://t.co/Z5YCpaRV6t,Positive
RT @netanyahu: Ever Stronger????? ???????????? https://t.co/Ecf5p4HjfZ,Neutral
#RiyadhSummit #POTUSAbroad???? https://t.co/WdDEOiV6oS,Neutral
Speech transcript at Arab Islamic American Summit ??https://t.co/eUWxJXJxbeReplay ??https://t.co/VtmlSqciXx#RiyadhSummit #POTUSAbroad,Neutral
RT @FLOTUS: I had a wonderful time with the students at the American International School #Riyadh today. #SaudiaArabia https://t.co/AVzVV0W…,Positive
Thank you to the BRAVE servicemen &amp; women who have served and continue to serve the United States- our true HEROES… https://t.co/ZTV9F639xM,Positive
Great to be in Riyadh Saudi Arabia. Looking forward to the afternoon and evening ahead. #POTUSAbroad https://t.co/JJOra0KfyR,Positive
#WeeklyAddress??????https://t.co/UYEhgch4Hl https://t.co/HIQoFuc5cy,Neutral
Getting ready for my big foreign trip. Will be strongly protecting American interests - that's what I like to do!,Positive
President Donald J. Trump Proclaims 5/14/2017 through 5/20/2017 as #PoliceWeekProclamation??… https://t.co/EcCsGaizWu,Positive
A great honor to welcome President Juan Manuel Santos of Colombia to the White House today!????????Joint Press Conf??… https://t.co/uWfiQEdsaY,Positive
With all of the illegal acts that took place in the Clinton campaign &amp; Obama Administration there was never a special counsel appointed!,Negative
This is the single greatest witch hunt of a politician in American history!,Positive
With all of the illegal acts that took place in the Clinton campaign &amp; Obama Administration there was never a special councel appointed!,Negative
It was my great honor to deliver the #CGACommencement17 at the @USCGAcademy. CONGRATULATIONS to the Class of 2017!… https://t.co/ehQanQXiSy,Positive
It was a great honor to welcome the President of Turkey Recep Tayyip Erdo?an to the @WhiteHouse today! https://t.co/4BWjOCgnNv,Positive
'U.S. Industrial Production Surged in April' https://t.co/S0Z4SEIRhi,Neutral
I have been asking Director Comey &amp; others from the beginning of my administration to find the LEAKERS in the intelligence community.....,Positive
...to terrorism and airline flight safety. Humanitarian reasons plus I want Russia to greatly step up their fight against ISIS &amp; terrorism.,Negative
As President I wanted to share with Russia (at an openly scheduled W.H. meeting) which I have the absolute right to do facts pertaining....,Positive
#PeaceOfficersMemorialDay and#PoliceWeek Proclamation: https://t.co/o4IXVfZuHw https://t.co/UMJ6hklx4a,Neutral
Today I delivered remarks at the 36th Annual National Peace Officers' Memorial Service. #NationalPoliceWeekWatch… https://t.co/3EioVDCTqb,Positive
Wishing @FLOTUS Melania and all of the great mothers out there a wonderful day ahead with family and friends! Happy #MothersDay,Positive
I was thrilled to be back @LibertyU. Congratulations to the Class of 2017! This is your day and you've earned it.… https://t.co/87RYOPwBiY,Positive
Will be interviewed by @JudgeJeanine on @FoxNews at 9:00 P.M. (Saturday night). Enjoy!,Positive
We,Neutral
#WeeklyAddress??????https://t.co/uT4K4fh88Y https://t.co/1iW7tVVNCH,Neutral
Today I welcomed the Victory Christian Center School. Good luck @ the Team America Rocketry Challenge! #TARC Watch… https://t.co/wFrRsK2wuo,Positive
Today @FLOTUS hosted a Military Mother's Day Event in the East Room of the WH. It was an honor to stop by say hel… https://t.co/wNVB0PYoef,Positive
China just agreed that the U.S. will be allowed to sell beef and other major products into China once again. This is REAL news!,Neutral
When James Clapper himself and virtually everyone else with knowledge of the witch hunt says there is no collusion when does it end?,Negative
"James Comey better hope that there are no ""tapes"" of our conversations before he starts leaking to the press!",Neutral
"...Maybe the best thing to do would be to cancel all future ""press briefings"" and hand out written responses for the sake of accuracy???",Positive
As a very active President with lots of things happening it is not possible for my surrogates to stand at podium with perfect accuracy!....,Positive
The Fake Media is working overtime today!,Negative
Again the story that there was collusion between the Russians &amp; Trump campaign was fabricated by Dems as an excuse for losing the election.,Negative
Yesterday on the same day- I had meetings with Russian Foreign Minister Sergei Lavrov and the FM of Ukraine Pavlo… https://t.co/hm4U54DCQO,Neutral
Russia must be laughing up their sleeves watching as the U.S. tears itself apart over a Democrat EXCUSE for losing the election.,Negative
We finally agree on something Rosie. https://t.co/BSP5F3PgbZ,Neutral
'Presidential Executive Order on the Establishment of Presidential Advisory Commission on Election Integrity'??… https://t.co/kVG8r7qZS5,Neutral
'Presidential Executive Order on Strengthening the Cybersecurity of Federal Networks and Critical Infrastructure'… https://t.co/kQDBvXPekk,Negative
The Democrats should be ashamed. This is a disgrace!#DrainTheSwamp https://t.co/UfbKEECm2V,Negative
Dems have been complaining for months &amp; months about Dir. Comey. Now that he has been fired they PRETEND to be aggrieved. Phony hypocrites!,Negative
The Roger Stone report on @CNN is false - Fake News. Have not spoken to Roger in a long time - had nothing to do with my decision.,Negative
caught he cried like a baby and begged for forgiveness...and now he is judge &amp; jury. He should be the one who is investigated for his acts.,Positive
years as a pol in Connecticut Blumenthal would talk of his great bravery and conquests in Vietnam - except he was never there. When....,Positive
"Watching Senator Richard Blumenthal speak of Comey is a joke. ""Richie"" devised one of the greatest military frauds in U.S. history. For....",Positive
RT @DRUDGE_REPORT: 10 SCANDALS ON DIRECTOR'S WATCH... https://t.co/dnGY08wTBP,Negative
Comey lost the confidence of almost everyone in Washington Republican and Democrat alike. When things calm down they will be thanking me!,Positive
RT @DRUDGE_REPORT: MEXICO 2ND DEADLIEST COUNTRY; TOPS AFGHAN IRAQ... https://t.co/i4FtSpLiHV,Positive
James Comey will be replaced by someone who will do a far better job bringing back the spirit and prestige of the FBI.,Positive
The Democrats have said some of the worst things about James Comey including the fact that he should be fired but now they play so sad!,Negative
"Cryin' Chuck Schumer stated recently ""I do not have confidence in him (James Comey) any longer."" Then acts so indignant.  #draintheswamp",Positive
'Manufacturing openings hires rise to highest levels of the recovery'https://t.co/txFZDYYIOe,Neutral
It was an honor to welcome the Teachers of the Year to the WH last month. Today we honor and thank all teachers!… https://t.co/sAUJfIZCwR,Positive
Biggest story today between Clapper &amp; Yates is on surveillance. Why doesn't the media report on this? #FakeNews!,Neutral
The Russia-Trump collusion story is a total hoax when will this taxpayer funded charade end?,Negative
Sally Yates made the fake media extremely unhappy today --- she said nothing but old news!,Negative
"Director Clapper reiterated what everybody including the fake media already knows- there is ""no evidence"" of collusion w/ Russia and Trump.",Negative
Honored to welcome Georgia Prime Minister Giorgi Kvirikashvili to the @WhiteHouse today with @VP Mike Pence.… https://t.co/ohXXgTNtWB,Positive
Ask Sally Yates under oath if she knows how classified information got into the newspapers soon after she explained it to W.H. Counsel.,Neutral
Ask Sally Yates under oath if she knows how classified information got into the newspapers soon after she explained it to W.H. Council.,Neutral
General Flynn was given the highest security clearance by the Obama Administration - but the Fake News seldom likes talking about that.,Neutral
Congratulations to @PGA_JohnDaly on his big win yesterday. John is a great guy who never gave up - and now a winner again!,Positive
RT @IsraeliPM: PM Benjamin Netanyahu at  weekly Cabinet meeting:In two weeks Israel will host @POTUS Trump on his first trip as President…,Positive
Rexnord of Indiana made a deal during the Obama Administration to move to Mexico. Fired their employees. Tax product big that's sold in U.S.,Neutral
Congratulations to Emmanuel Macron on his big win today as the next President of France. I look very much forward to working with him!,Positive
Republican Senators will not let the American people down! ObamaCare premiums and deductibles are way up - it was a lie and it is dead!,Negative
RT @brunelldonald: I thought about jobs that went overseas failing schools open borders not my skin color when I voted @realDonaldTrump! I…,Negative
"RT @FoxNews: .@POTUS: ""I'm not against the media. I'm against the FAKE media."" #CashinIn https://t.co/F7mBIj7iVL",Negative
When will the Fake Media ask about the Dems dealings with Russia &amp; why the DNC wouldn't allow the FBI to check their server or investigate?,Negative
The reason I am staying in Bedminster N. J. a beautiful community is that staying in NYC is much more expensive and disruptive. Meetings!,Neutral
Great jobs report today - It is all beginning to work!,Positive
Why is it that the Fake News rarely reports Ocare is on its last legs and that insurance companies are fleeing for their lives? It's dead!,Negative
Wowthe Fake News media did everything in its power to make the Republican Healthcare victory look as bad as possible.Far better than Ocare!,Neutral
#WeeklyAddress???? https://t.co/4qckKpbtCR,Neutral
JOBS JOBS JOBS! https://t.co/UR0eetSEnO,Neutral
Of course the Australians have better healthcare than we do --everybody does. ObamaCare is dead! But our healthcare will soon be great.,Positive
Rather than causing a big disruption in N.Y.C. I will be working out of my home in Bedminster N.J. this weekend. Also saves country money!,Negative
Big win in the House - very exciting! But when everything comes together with the inclusion of Phase 2 we will have truly great healthcare!,Positive
An honor to welcome PM of Australia @TurnbullMalcolm to America &amp; join him in marking the 75th Anniversary of the… https://t.co/foMUec7EAE,Positive
It was a GREAT day for the United States of America! This is a great plan that is a repeal &amp; replace of ObamaCare.… https://t.co/0TnmLn55Lm,Positive
If victorious Republicans will be having a big press conference at the beautiful Rose Garden of the White House immediately after vote!,Positive
Insurance companies are fleeing ObamaCare - it is dead. Our healthcare plan will lower premiums &amp; deductibles - and be great healthcare!,Neutral
"I am watching the Democrats trying to defend the ""you can keep you doctor you can keep your plan &amp; premiums will go down"" ObamaCare lie.""",Negative
Beautiful evening with Religious Leaders here at the WH last night. Join us now for a #NationalDayofPrayer LIVE:… https://t.co/b8j1tWZJuv,Positive
Death spiral!'Aetna will exit Obamacare markets in VA in 2018 citing expected losses on INDV plans this year'https://t.co/5YnzDitF8r,Negative
RT @foxandfriends: President Trump to sign an executive order on religious liberty today the National Day of Prayer | @kevincorke https://…,Positive
Congratulations to @foxandfriends on its unbelievable ratings hike.,Neutral
The Fake News media is officially out of control. They will do or say anything in order to get attention - never been a time like this!,Neutral
...allegations of unmasking Trump transition officials. Not good!,Positive
Susan Rice the former National Security Advisor to President Obama is refusing to testify before a Senate Subcommittee next week on.....,Negative
An honor to host President Mahmoud Abbas at the WH today. Hopefully something terrific could come out it between th… https://t.co/eyHLFZbKhn,Positive
It was an honor to stop by a #SchoolChoice event hosted by @VP Pence and @usedgov Secretary @BetsyDeVosED at the… https://t.co/B8VxVsYNHA,Positive
...Trump/Russia story was an excuse used by the Democrats as justification for losing the election. Perhaps Trump just ran a great campaign?,Neutral
FBI Director Comey was the best thing that ever happened to Hillary Clinton in that he gave her a free pass for many bad deeds! The phony...,Neutral
Congratulations to the winners of the Commander-in-Chief's Trophy the great Air Force Falcons! Watch:… https://t.co/HyxxFCfaUh,Positive
"either elect more Republican Senators in 2018 or change the rules now to 51%. Our country needs a good ""shutdown"" in September to fix mess!",Neutral
The reason for the plan negotiated between the Republicans and Democrats is that we need 60 votes in the Senate which are not there! We....,Neutral
President Andrew Jackson who died 16 years before the Civil War started saw it coming and was angry. Would never have let it happen!,Negative
#ICYMI- On Saturday I signed two EO's to help keep jobs &amp; wealth in our country.EO1: https://t.co/XJggnJAiPi EO2:… https://t.co/2iEten4SVl,Neutral
This month we celebrate the contributions of Asian Americans &amp; Pacific Islanders that enrich our Nation. https://t.co/rEJi9ahOaY,Positive
...healthcare plan is on its way. Will have much lower premiums &amp; deductibles while at the same time taking care of pre-existing conditions!,Neutral
You can't compare anything to ObamaCare because ObamaCare is dead. Dems want billions to go to Insurance Companies to bail out donors....New,Neutral
The Democrats without a leader have become the party of obstruction.They are only interested in themselves and not in what's best for U.S.,Positive
Big excitement last night in the Great State of Pennsylvania! Fantastic crowd and people. MAKE AMERICA GREAT AGAIN!,Positive
I will be interviewed on @FaceTheNation this morning at 10:00 A.M. Have a great day!,Positive
RT @charliekirk11: 100 days ago a new message leader &amp; movement took the Oval Office! A government FOR the people BY the people. This is…,Neutral
Mainstream (FAKE) media refuses to state our long list of achievements including 28 legislative signings strong borders &amp; great optimism!,Positive
Looking forward to RALLY in the Great State of Pennsylvania tonight at 7:30. Big crowd big energy!,Positive
".@LouDobbs just stated that ""President Trump's successes are unmatched in recent presidential history""  Thank you Lou!",Positive
RT @foxnation: . @TuckerCarlson : #Dems Don't Really Believe #Trump Is a Pawn of #Russia - That's Just Their Political Tool  https://t.co/K…,Positive
North Korea disrespected the wishes of China &amp; its highly respected President when it launched though unsuccessfully a missile today. Bad!,Negative
I will be interviewed by @MarthaMaccallum on @FoxNews tonight at 7pm. Enjoy!,Positive
We are making tremendous progress with the V. A. There has never been so much done so quickly and we have just started. We love our VETS!,Positive
"RT @foxandfriends: Former President Obama's $400K Wall Street speech stuns liberal base; Sen. Warren saying she ""was troubled by that"" http…",Negative
Today I signed an Executive Order on Improving Accountability and Whistleblower Protection at the @DeptVetAffairs:… https://t.co/UQ6VNCyhlj,Positive
Presidential Memorandum for the @CommerceGov @SecretaryRoss re: Aluminum Imports and Threats to National Security:… https://t.co/GnKoVz9GTO,Negative
.@FLOTUS Melania and I were honored to welcome Argentina President @MauricioMacri and First Lady Juliana Awada to t… https://t.co/gR3EPznu1H,Positive
As families prepare for summer vacations in our National Parks - Democrats threaten to close them and shut down the government. Terrible!,Negative
Democrats used to support border security — now they want illegals to pour through our borders.,Positive
Democrats jeopardizing the safety of our troops to bail out their donors from insurance companies. It is time to put #AmericaFirst????,Neutral
What's more important? Rebuilding our military - or bailing out insurance companies? Ask the Democrats.,Positive
I promise to rebuild our military and secure our border. Democrats want to shut down the government. Politics!,Positive
I want to help our miners while the Democrats are blocking their healthcare.,Neutral
The Democrats want to shut government if we don't bail out Puerto Rico and give billions to their insurance companies for OCare failure. NO!,Neutral
...subject to the fact that if we do not reach a fair deal for all we will then terminate NAFTA. Relationships are good-deal very possible!,Positive
I received calls from the President of Mexico and the Prime Minister of Canada asking to renegotiate NAFTA rather than terminate. I agreed..,Neutral
Democrats are trying to bail out insurance companies from disastrous #ObamaCare and Puerto Rico with your tax dollars. Sad!,Negative
A great great honor to welcome &amp; recognize the National Teacher of the Year as well as the Teacher of the Year fro… https://t.co/pUGl7RDoVX,Positive
Today I signed an Executive Order on Enforcing Statutory Prohibitions on Federal Control of Education. EO:… https://t.co/YYafFQncbC,Neutral
Today I signed an Executive Order @ the U.S. Dept. of @Interior: 'Review of Designations Under the Antiquities Act… https://t.co/Eq6JDzMqTY,Neutral
HAPPY BIRTHDAY to our @FLOTUS Melania! https://t.co/rYYp51mxDQ https://t.co/np7KYHglSv,Positive
The U.S. recorded its slowest economic growth in five years (2016). GDP up only 1.6%. Trade deficits hurt the economy very badly.,Negative
"...the Ninth Circuit which has a terrible record of being overturned (close to 80%). They used to call this ""judge shopping!"" Messy system.",Negative
"Out of our very big country with many choices does everyone notice that both the ""ban"" case and now the ""sanctuary"" case is brought in ...",Neutral
First the Ninth Circuit rules against the ban &amp; now it hits again on sanctuary cities-both ridiculous rulings. See you in the Supreme Court!,Neutral
'Presidential Executive Order on Promoting Agriculture and Rural Prosperity in America'Executive Order:… https://t.co/LVMjZ9Ax0U,Positive
